Keyword,Intent,Volume,Keyword Difficulty,CPC (USD)
charter jets costs,,0,,0.00
charter jets dallas,,0,,4.90
charter jets dallas tx,,0,,0.00
charter jets delaware,,0,,0.00
charter jets edmonton,,0,,0.00
charter jets empty leg tulsa,,0,,0.00
charter jets empty legs,,0,,0.00
charter jets empty seats,,0,,0.00
charter jets from charlotte to elmira,,0,,0.00
charter jets from hawaii,,0,,0.00
charter jets from ny to england,,0,,0.00
charter jets ft worth,,0,,0.00
charter jets golfing results,,0,,0.00
charter jets halifax,,0,,0.00
charter jets houston,,0,,4.25
charter jets houston tx,,0,,0.00
charter jets in india,,0,,0.00
charter jets in iowa,,0,,0.00
charter jets in mt juliet,,0,,0.00
charter jets in nashville,,0,,0.00
charter jets in nyc to nashville,,0,,0.00
charter jets in van nuys,,0,,0.00
charter jets inc,,0,,0.00
charter jets india,,0,,0.00
charter jets lambert airport,,0,,0.00
charter jets llc,,0,,0.00
charter jets los angeles,,0,,3.85
charter jets lt,,0,,0.00
charter jets minnesota,,0,,0.00
charter jets omaha,,0,,0.00
charter jets orlando to tampa,,0,,0.00
charter jets ottawa,,0,,0.00
charter jets out of burbank,,0,,0.00
charter jets out of front range airport co,,0,,0.00
charter jets out of lnken,,0,,0.00
charter jets philadelphia,,0,,0.00
charter jets pictures,,0,,0.00
charter jets price,,0,,0.00
charter jets rates,,0,,2.67
charter jets rekvizitai,,0,,0.00
charter jets san antonio,,0,,3.92
charter jets san francisco,,0,,0.00
charter jets scottsdale,,0,,0.00
charter jets sex,,0,,0.00
charter jets south africa,,0,,0.00
charter jets tampa,,0,,0.00
charter jets that allow smoking,,0,,0.00
charter jets to europe,,0,,0.00
charter jets to london,,0,,6.38
charter jets to vegas,,0,,2.93
charter jets toronto,,0,,0.00
charter jets types,,0,,0.00
charter jets uab vilnius,,0,,0.00
charter jets uk,,0,,0.00
charter jets usa,,0,,0.00
charter jets van nuys,,0,,0.00
charter jets vancouver,,0,,0.00
charter jets vilnius,,0,,0.00
charter jets vip for 26 passengers,,0,,0.00
charter jets windsor,,0,,0.00
charter jets with avalaible seats,,0,,0.00
charter jets with beds,,0,,0.00
charter jets with sexy attendants,,0,,0.00
charter jetting,,0,,0.00
charter jumbo jets,,0,,0.00
charter large jet,,0,,0.00
charter lear jet,,0,,1.96
charter light jet,,0,,0.00
charter light jet cost,,0,,0.00
charter long range jet,,0,,0.00
charter long range private jet,,0,,0.00
charter luxor to safaga jet,,0,,0.00
charter luxury jet,,0,,0.00
charter luxury yacht dubai jet ski,,0,,0.00
charter my jet,,0,,1.64
charter my jet to someone else,,0,,0.00
charter my private jet,,0,,0.00
charter new england patriots jet,,0,,0.00
charter one jet,,0,,0.00
charter or buy private jet,,0,,0.00
charter plane from colorado honda jet,,0,,0.00
charter plans small jets ny to lisbon price calculator,,0,,0.00
charter private jet aircraft,,0,,0.00
charter private jet aircraft flights,,0,,0.00
charter private jet app,,0,,0.00
charter private jet athens,,0,,1.57
charter private jet atlanta,,0,,3.74
charter private jet buffalo,,0,,0.00
charter private jet calgary,,0,,0.00
charter private jet canada,,0,,4.31
charter private jet charter flights,,0,,0.00
charter private jet chicago,,0,,3.67
charter private jet companies,,0,,0.00
charter private jet company,,0,,0.00
charter private jet cost uk,,0,,0.00
charter private jet costs,,0,,1.57
charter private jet dc to miami,,0,,0.00
charter private jet dubai,,0,,0.00
charter private jet from oklahoma city to las vegas nevada,,0,,0.00
charter private jet from rdu,,0,,0.00
charter private jet hickory nc,,0,,0.00
charter private jet in china,,0,,0.00
charter private jet in china cost,,0,,0.00
charter private jet in toronto,,0,,0.00
charter private jet india,,0,,2.90
charter private jet international,,0,,2.90
charter private jet jakarta bali,,0,,0.00
charter private jet los angeles,,0,,5.41
charter private jet mykonos,,0,,1.57
charter private jet new york,,0,,0.00
charter private jet new york to miami,,0,,0.00
charter private jet online,,0,,0.00
charter private jet phoenix to denver,,0,,0.00
charter private jet price in india,,0,,0.00
charter private jet quote,,0,,0.00
charter private jet quote online,,0,,0.00
charter private jet rates uk,,0,,0.00
charter private jet regina,,0,,0.00
charter private jet sacramento,,0,,0.00
charter private jet salzburg,,0,,0.00
charter private jet services,,0,,0.00
charter private jet singapore,,0,,0.00
charter private jet sydney,,0,,0.00
charter private jet to bonaire,,0,,0.00
charter private jet to hawaii,,0,,2.29
charter private jet to las vegas,,0,,3.54
charter private jet to nice,,0,,0.00
charter private jet to nigeria,,0,,0.00
charter private jet to vegas,,0,,0.00
charter private jet toronto,,0,,4.80
charter private jet uk,,0,,13.76
charter private jet uk cost,,0,,0.00
charter private jet winnipeg,,0,,0.00
charter private jets europe,,0,,0.00
charter private jets price in india,,0,,0.00
charter proivate jet,,0,,0.00
charter provate jet,,0,,0.00
charter rates for private jets,,0,,1.57
charter school private jet,,0,,0.00
charter service private jet group,,0,,0.00
charter services offering gulfstream 280 jets,,0,,0.00
charter small jet boston ma portland or,,0,,0.00
charter super midsize jet,,0,,0.00
charter super midsize jets,,0,,0.00
charter super midsize jets los angeles,,0,,0.00
charter super midsize jets san diego,,0,,0.00
charter super midsize jets seattle,,0,,0.00
charter super midsize jets southern california,,0,,0.00
charter team jets,,0,,0.00
charter team overwing jets,,0,,0.00
charter very light jet,,0,,0.00
charter vip 737 jet,,0,,0.00
charter vip jet,,0,,0.00
charter vip jet 737,,0,,0.00
charter vip jet 757,,0,,0.00
charter vip jet charter,,0,,0.00
charter vip jet for 50 passengers,,0,,0.00
charter von einem jet,,0,,0.00
charter vs buy jet,,0,,0.00
charter vs jet card,,0,,0.00
charter.jet,,0,,2.74
cheap charter jet rates,,0,,0.00
cheap flights charter jets,,0,,0.00
cheap jet charter flights,,0,,0.00
cheap jet charter rates,,0,,0.00
cheap private charter jet,,0,,0.00
cheap private charter jet tickets,,0,,0.00
cheap private jet charter europe,,0,,0.00
cheap private jet charter flights,,0,,0.00
cheap private jet charter to austin tx,,0,,0.00
cheap private jet charter uk,,0,,0.00
cheap private jet charter usa,,0,,0.00
cheap private jets charter,,0,,1.98
cheaper to own a jet or to charter oen,,0,,0.00
cheapest charter jet to hawaii,,0,,0.00
cheapest charter jets,,0,,0.00
cheapest jet charter sacramento to las vegas,,0,,0.00
cheapest private jet to charter,,0,,0.00
cheater nitrous jet chart,,0,,0.00
chicago business jet charter,,0,,0.00
chicago charter jet,,0,,3.33
chicago executive airport jet charter,,0,,0.00
chicago illinois jet charter,,0,,0.00
chicago jet charter price,,0,,0.00
chicago jet charter rental,,0,,0.00
chicago private jet charter flights chicago il,,0,,0.00
chicago private jet charter price,,0,,0.00
chicago private jet charter quote,,0,,0.00
chicagoland jet charter,,0,,0.00
china eastern airbus a330 jet seating chart,,0,,0.00
china investors private charter jets,,0,,0.00
china investors private charter jets investor,,0,,0.00
china private jet charter,,0,,0.00
chinese horary jet lag chart,,0,,0.00
chino hills private jet charter,,0,,0.00
chord chart steve millar jet airliner,,0,,0.00
chord chart steve millar jet ajrlin,,0,,0.00
chris ivory jets depth chart,,0,,0.00
christina nesbit jet charter,,0,,0.00
cirrus jet charter rates,,0,,0.00
cirrus jet for charter,,0,,0.00
cirrus vision jet charter price,,0,,0.00
cirrus vision jet charter raleigh nc,,0,,0.00
citation jet charter rates,,0,,0.00
clark county jet charter,,0,,0.00
classic jet charter,,0,,0.00
clavin knowlton jet charter,,0,,0.00
clay lacy aviation jet charter,,0,,0.00
clay lacy aviation private jet charter & management,,0,,0.00
clay lacy aviation private jet charter &amp,,0,,0.00
clay lacy private jet charter,,0,,0.00
cleveland brown charter jet stuck in md 2012,,0,,0.00
cleveland browns depth chart vs jets,,0,,0.00
cleveland browns vs jets matchup chart,,0,,0.00
cleveland jet charter rental,,0,,0.00
cleveland private jet charter,,0,,0.00
clientele charter private jets,,0,,0.00
clone jet size chart,,0,,0.00
club jet charter careers,,0,,0.00
club jet charter jet services,,0,,0.00
club jet charter mn,,0,,0.00
club jet charter news,,0,,0.00
club jet charter reviews,,0,,0.00
coat to charter jet,,0,,0.00
cobalt jet charter,,0,,0.00
coleman jet charter,,0,,0.00
colombus jet charter,,0,,0.00
colorado charter a jet,,0,,0.00
colorado springs jet charter,,0,,0.00
colorado springs private jet charter,,0,,0.00
columbia jet charter,,0,,0.00
columbus charter jet,,0,,0.89
columbus jet charter,,0,,0.00
columbus ohio jet charter,,0,,0.00
combo jet spray chart,,0,,0.00
combo-jet nozzle chart,,0,,0.00
comfortable private charter jets,,0,,0.00
commercial charter jets,,0,,0.00
commercial jet airports to charter jet airports,,0,,0.00
commercial jet charter broker,,0,,0.00
commercial jet charter prices,,0,,0.00
commercial jet size comparison chart,,0,,0.00
commutair embraer emb 145 jet seating chart,,0,,0.00
commuteair embraer emb 145 jet seating chart,,0,,0.00
company jet charter,,0,,0.00
company use private jet charter,,0,,0.00
compare charter jet pricing,,0,,0.00
compare jet charter,,0,,0.00
compare private jet charter prices,,0,,0.00
comparing jet charter jet services,,0,,0.00
concert jet charter,,0,,0.00
consumption of jet fuel in usa bar charts,,0,,0.00
contentinal jet charter,,0,,0.00
continental jet charter llp,,0,,0.00
continental jet charter llp vero beach fl,,0,,0.00
convenience of a private charter jet,,0,,0.00
convert flash-based anychart charts to oracle jet,,0,,0.00
cop28 private charter jets,,0,,0.00
coronavirus private jet charter,,0,,0.00
corporate charter jet ccj limited,,0,,0.00
corporate jet charter australia,,0,,0.00
corporate jet charter brisbane,,0,,0.00
corporate jet charter evansville in,,0,,0.00
corporate jet charter from omaha to tacoma narrows airport,,0,,0.00
corporate jet charter nashville tn,,0,,0.00
corporate jet charter nz,,0,,0.00
corporate jet charter perth,,0,,0.00
corporate travel jet charter,,0,,0.00
correct jet size chart for edelbrock,,0,,0.00
cortina d'ampezzo italy jet charter,,0,,0.00
cost charter a private jet,,0,,0.00
cost charter jet us to europe,,0,,0.00
cost charter jet usa to australlia,,0,,0.00
cost charter jets,,0,,1.66
cost charter private jet new york london,,0,,0.00
cost effective jet with bed charter,,0,,0.00
cost jet charter,,0,,0.00
cost midsize jet charter,,0,,0.00
cost of a charter private jet,,0,,0.00
cost of a private charter jet,,0,,0.00
cost of a private jet flight charter,,0,,0.00
cost of business jet charter,,0,,0.00
cost of charter a private jet,,0,,0.00
cost of charter jet baler to cabanatuan,,0,,0.00
cost of charter jet to europe,,0,,0.00
cost of charter jets,,0,,0.00
cost of charter private jet,,0,,1.57
cost of jet charter between arizona and utah,,0,,0.00
cost of jet charter ny to sfo,,0,,0.00
cost of jet charter per hour,,0,,1.28
cost of net jets charter miaimi to paris,,0,,0.00
cost of net jets charter to paris,,0,,0.00
cost of private charter jet,,0,,1.57
cost of private jet charter in australia,,0,,0.00
cost of private jet charter in nigeria,,0,,0.00
cost of private jet charter service,,0,,0.00
cost of private jet charter to india,,0,,0.00
cost private jet charter service,,0,,0.00
cost private jet charter to ft larterdal fl,,0,,0.00
cost private jet charter to ft lauderdale fl,,0,,0.00
cost to chart a private jet,,0,,0.00
cost to charter a boeing business jet,,0,,0.00
cost to charter a business jet,,0,,0.00
cost to charter a commercial jet,,0,,0.00
cost to charter a honda jet,,0,,0.00
cost to charter a jet from sfo to hong kong,,0,,0.00
cost to charter a jet from ugn to hya,,0,,0.00
cost to charter a jet san diego to las vegas,,0,,0.00
cost to charter a jet to bangkok from seattle,,0,,0.00
cost to charter a jet to china,,0,,0.00
cost to charter a jet to hawaii,,0,,0.00
cost to charter a jet to las vegas,,0,,0.00
cost to charter a jumbo jet,,0,,0.00
cost to charter a light jet,,0,,0.00
cost to charter a private jet per hour,,0,,0.00
cost to charter a regional jet,,0,,0.00
cost to charter a small jet 2 hours,,0,,0.00
cost to charter boeing business jet,,0,,0.00
cost to charter business jet,,0,,0.00
cost to charter deer jet,,0,,0.00
cost to charter gulfstream jet,,0,,0.00
cost to charter honda jet,,0,,0.00
cost to charter jet for 100 people,,0,,0.00
cost to charter jet from chicago to san francisco,,0,,0.00
cost to charter jet from la to hawaii,,0,,0.00
cost to charter jet to europe,,0,,0.00
cost to charter jets,,0,,0.00
cost to charter jetsetter jet,,0,,0.00
cost to charter midsize jet,,0,,0.00
cost to charter passenger jet,,0,,0.00
cost to charter private jet from atlanta to florence italy,,0,,0.00
cost to charter private jet from portland to tampa,,0,,0.00
cost to fly charter jet,,0,,0.00
costa mesa jet charter,,0,,0.00
costa rica charter jet,,0,,0.00
costa rica jet charter,,0,,0.00
costco charter jet,,0,,0.00
costs commercial vs jet charter,,0,,0.00
costs of charter of business jet,,0,,0.00
costs of fighter jets chart,,0,,0.00
costs to charter a private jet,,0,,1.12
courchevel france jet charter,,0,,0.00
covenant charter jet birmingham al,,0,,0.00
cr jet 900 seating chart,,0,,0.00
cr jet 900 seating chart american airlines,,0,,0.00
cr250 jetting chart fmf,,0,,0.00
cr250r jetting chart,,0,,0.00
cr900 jet seating chart,,0,,0.00
crf 230 jetting chart,,0,,0.00
crf 250 jetting chart,,0,,0.00
crf jetting chart,,0,,0.00
crf150f jet chart,,0,,0.00
crf50 honda jet to altitude chart,,0,,0.00
crj canadair regional jet seating chart us airways,,0,,0.00
crj-200 jet seating chart,,0,,0.00
crj-700 canadair reg jet seating chart,,0,,0.00
crj-700 canadair regional jet seating chart united,,0,,0.00
crj-700 jet seating chart,,0,,0.00
crj-canadair regional jet seating chart air canada,,0,,0.00
crossville jet charter,,0,,0.00
crossville jet charter sean s,,0,,0.00
crossville jet charter sean smith,,0,,0.00
crypto jet charter,,0,,0.00
crystal 777 charter jet,,0,,0.00
crystal jet charter,,0,,0.00
current jet stream chart,,0,,0.00
current us fighter jets chart,,0,,0.00
custom jet charter,,0,,5.16
custom jet charter fleet,,0,,0.00
cyprus jet charter,,0,,0.00
cyprus private jet charter,,0,,0.00
dallas aircraft sales and jet charter,,0,,0.00
dallas based jet charter,,0,,0.00
dallas charter jet,,0,,4.90
dallas jet charter companies,,0,,0.00
dallas jet charter flight,,0,,0.00
dallas jet charter services,,0,,0.00
dallas love field jet charter,,0,,0.00
dallas private jet charter flight,,0,,3.99
dallas private jet charter quote,,0,,0.00
dallas private jet charter the early a,,0,,0.00
dallas private jet charter the early air way,,0,,0.00
dallas private jet charter the early airway dallas tx,,0,,0.00
dallas texas jet charter,,0,,0.00
dallas to houston private jet charter,,0,,0.00
dallas to las vegas jet charter,,0,,0.00
dallas to teterboro private jet charter,,0,,0.00
dallas to washington dulles private jet charter,,0,,0.00
darlington southern 500 private jet charter,,0,,0.00
dassault jet charter,,0,,0.00
david dobrik private jet charter,,0,,0.00
davinci charter jet,,0,,0.00
daytona beach jet charter,,0,,0.00
dc jet charter,,0,,3.38
dc private jet charter flights,,0,,0.00
dca jet charter,,0,,0.00
dcoe weber carburetor jetting chart,,0,,0.00
dead head jet charter,,0,,0.77
deadhead private jet charter houston to new york,,0,,0.00
deep chart jets,,0,,0.00
deer jet 787 charter cost,,0,,0.00
deer jet 787 charter rates,,0,,0.00
deer jet charter cost,,0,,0.00
deer jet charter price,,0,,0.00
deer jet dreamliner charter,,0,,0.00
deer jet private charter,,0,,0.00
delaware jet charter,,0,,0.00
delaware private jet charter the early,,0,,0.00
delaware private jet charter the early air way,,0,,0.00
dellorto carb jetting chart,,0,,0.00
delorto carb jetting chart,,0,,0.00
delta 757 jet seating chart,,0,,0.00
delta a333 jet seating chart,,0,,0.00
delta air lines canadair regional jet seating chart,,0,,0.00
delta airbus a330 jet seating chart,,0,,0.00
delta airbus industrie a332 jet seating chart,,0,,0.00
delta airbus industrie a333 jet seating chart,,0,,0.00
delta airbus jet seating chart,,0,,0.00
delta airlines canadair regional jet seating chart,,0,,0.00
delta airlines charter jets,,0,,0.00
delta airlines jet charter,,0,,0.00
delta airlines private jet charter,,0,,0.00
delta boeing 717 jet seating chart,,0,,0.00
delta boeing 744 jet seating chart,,0,,0.00
delta boeing 747 jet seating chart,,0,,0.00
delta boeing 767-400 jet seating chart,,0,,0.00
delta boeing 777 jet seating chart,,0,,0.00
delta boeing 777-200lr jet seating chart,,0,,0.00
delta canadair jet seating chart,,0,,0.00
delta canadair regional jet 900 seating chart,,0,,0.00
delta canadair regional jet seating chart,,0,,0.00
delta charter jet cost,,0,,0.00
delta charter jet service,,0,,0.00
delta charter private jets,,0,,0.00
delta crj-canadair regional jet seating chart,,0,,0.00
delta embraer emb 175 jet seating chart,,0,,0.00
delta express jet seating chart,,0,,0.00
delta private jet charter cost,,0,,0.00
delta private jets charter,,0,,0.00
denver charter jet,,0,,0.00
denver jet charter block time,,0,,0.00
denver private jet flights a a aircraft charter,,0,,0.00
depht chart jets,,0,,0.00
deprh chart jets,,0,,0.00
depth chart for new york jets,,0,,0.00
depth chart for ny jets,,0,,0.00
depth chart for the jets,,0,,0.00
depth chart jets 2014,,0,,0.00
depth chart jets 2015,,0,,0.00
depth chart jets 2019,,0,,0.00
depth chart jets 2020,,0,,0.00
depth chart new york jetsnew york jets team depth-chart,,0,,0.00
depth chart ny jets 2018,,0,,0.00
depth chart winnipeg jets,,0,,0.00
der jet charter,,0,,0.00
derek jeter career hit chart,,0,,0.00
derek jeter career spray chart,,0,,0.00
derek jeter dating chart,,0,,0.00
derek jeter girl chart,,0,,0.00
derek jeter hit spray chart,,0,,0.00
derek jeter hit spray chart r baseball,,0,,0.00
derek jeter spray chart,,0,,0.00
des moines jet charter,,0,,0.00
des moines private jet charter,,0,,0.00
detroit jet charter,,0,,1.46
dfev progressive carburetor jet chart,,0,,0.00
dfev progressive carburetor jet chart-weber,,0,,0.00
dfw jet charter,,0,,0.00
dfw private jet charter,,0,,0.00
direct jet charter greensboro,,0,,0.00
direct jet charter llc greensboro nc,,0,,0.00
discount charter jet,,0,,0.00
discount charter jets,,0,,0.00
discount private jet charter seattle to thailand,,0,,0.00
discounted one-way jet charter flights,,0,,0.00
discovery jets charter,,0,,0.00
dnmm jet charter,,0,,0.00
do college football programs charter jets,,0,,0.00
do nashville pred have charter jet,,0,,0.00
does it cost to charter a private jet,,0,,0.00
does villanova basketball team fly on charter jet,,0,,0.00
dominican republic jet charter,,0,,0.00
dornier 328 jet charter cost,,0,,0.00
dornier jet charter,,0,,0.00
downtown la jet charter,,0,,0.00
dr650 jetting chart,,0,,0.00
dream jet charter,,0,,0.00
drill bit jet size chart kehin,,0,,0.00
drill jet size chart,,0,,0.00
drilling jets chart,,0,,0.00
dry shot diesel jet chart,,0,,0.00
drz 400 jetting chart,,0,,0.00
drz jet chart,,0,,0.00
drz125 jetting chart,,0,,0.00
drz400e jetting chart,,0,,0.00
dubai jet charter services,,0,,0.00
dukejets llc aviation private jet charters air charter denver,,0,,0.00
dumont jet charter,,0,,0.00
dupage aerospace chicago private jet charter,,0,,0.00
dupage airport jet charter,,0,,0.00
dupage flight center jet charter,,0,,0.00
dupage jet charter,,0,,0.00
dyno jet turbo ls chart,,0,,0.00
dyno tune nitrous jet chart,,0,,0.00
dynojet jet conversion chart,,0,,0.00
dynojet keenan jet chart,,0,,0.00
dynojet keihin jet chart,,0,,0.00
e jet exclusive charter,,0,,0.00
e190 seating chart jet blue,,0,,0.00
e2 seating chart jet,,0,,0.00
e85 jet chart,,0,,0.00
e85 nitrous jetting chart,,0,,0.00
eagle jet charter las vegas,,0,,0.00
eagle-vail private jet charter,,0,,0.00
early birds jet charter company,,0,,0.00
eas jet charter miami,,0,,0.00
east coast charter jets,,0,,0.00
easy jet charter flights,,0,,0.00
easy jet charter management,,0,,0.00
easy jet route selection baggage chart,,0,,0.00
ebbr jet charter,,0,,0.00
ecelipse jet charter,,0,,0.00
eclipse jet charter atlanta,,0,,0.00
eclipse jet charter colorado springs,,0,,0.00
eclipse jet charter cost,,0,,0.00
eclipse jet charter rates,,0,,0.00
eclipse jets for charter,,0,,0.00
eddb jet charter,,0,,0.00
eddm jet charter,,0,,0.00
edelbrock 1404 jet chart,,0,,0.00
edelbrock 1405 jetting chart,,0,,0.00
edelbrock 1406 med rods and jets tuning chart,,0,,0.00
edelbrock 1406 primary jetting chart,,0,,0.00
edelbrock 1407 jet chart,,0,,0.00
edelbrock 1812 jet chart,,0,,0.00
edelbrock carb jet chart,,0,,0.00
edelbrock jet and metering rod chart,,0,,0.00
edelbrock jet chart 1407,,0,,0.00
edelbrock metering jet chart,,0,,0.00
edelbrock performer rpm nitrous jet chart,,0,,0.00
edelbrock rod and jet chart,,0,,0.00
eden prairie jet charter,,0,,0.00
edinburgh private jet charter,,0,,0.00
edinburgh scotland jet charter,,0,,0.00
edmonton jet charter,,0,,0.00
edmonton private jet charter,,0,,0.00
efi nitrous jet chart,,0,,0.00
egaa jet charter,,0,,0.00
ejm jet charter,,0,,0.00
el paso jet charter,,0,,0.00
elevation temperature jetting chart,,0,,0.00
elite air jets charter,,0,,0.00
elite aviation private jet charter denver colorado,,0,,0.00
elite charter jet,,0,,0.00
elite jet charter llc,,0,,0.00
elite jets charter llc,,0,,0.00
elizabeth warren private jet company air charter team,,0,,0.00
emb 175 jet seating chart,,0,,0.00
emb 190 jet seating chart,,0,,0.00
emb e90 jet seating chart,,0,,0.00
embraer 135 regional jet seating chart,,0,,0.00
embraer 145 jet seating chart,,0,,0.00
embraer 170 175 twin jet seating chart,,0,,0.00
embraer 170 175 twin-jet e170 seating chart,,0,,0.00
embraer 170 190 jet seating chart,,0,,0.00
embraer 170 jet seating chart,,0,,0.00
embraer 175 regional jet seating chart,,0,,0.00
embraer 175 twin jet seating chart,,0,,0.00
embraer 175 twin-jet e170 aircraft seating chart,,0,,0.00
embraer 190 jet seating chart,,0,,0.00
embraer 190 regional jet seating chart,,0,,0.00
embraer emb 145 regional jet seating chart,,0,,0.00
embraer emb 175 jet seating chart american airlines,,0,,0.00
embraer emb 175 jet seating chart delta,,0,,0.00
embraer emb 175 jet seating chart flybe,,0,,0.00
embraer emb e90 jet seating chart,,0,,0.00
embraer emb e90 jet seating chart aeromexico,,0,,0.00
embraer emb e90 jet seating chart air canada,,0,,0.00
embraer erj 140 regional jet seating chart,,0,,0.00
embraer erj-140 regional jet seating chart,,0,,0.00
embraer erj-145 twin-jet seating chart,,0,,0.00
embraer erj-190 twin-jet seating chart,,0,,0.00
embraer executive jets chart range,,0,,0.00
embraer jet e90 seating chart,,0,,0.00
embraer regional jet seating chart american airlines,,0,,0.00
embraer rj135 jet seating chart,,0,,0.00
embraer rj145 amazon jet seating chart american airlines,,0,,0.00
embraer rj145 jet seating chart,,0,,0.00
embraer twin jet seating chart,,0,,0.00
embrarer jet seating chart,,0,,0.00
emergency jet charter,,0,,1.88
emirates boeing 777-200lr jet seating chart,,0,,0.00
emirates private jet charter cost,,0,,0.00
empi brosol & solex carburetor main jet size chart,,0,,0.00
empi carb jetting chart,,0,,0.00
empi d series carburetors jetting chart,,0,,0.00
empi dellorto jet chart,,0,,0.00
empi dellorto jet chart engine size,,0,,0.00
empresas de charter de jets privados,,0,,0.00
empty jet charter from toronto,,0,,0.00
empty jet legs charter,,0,,0.00
empty leg charter jet,,0,,0.00
empty leg charter jet flights,,0,,0.00
empty leg charter jets,,0,,0.00
empty leg charter private jet,,0,,0.00
empty leg jet charter albuquerque,,0,,0.00
empty leg jet charter rates,,0,,0.00
empty leg jet charter uk,,0,,0.00
empty legs jet charter,,0,,0.00
empty seats charter jets,,0,,0.00
empyreal jet charter,,0,,0.00
eric lance horizon jet charter,,0,,0.00
erica horizon jet charter,,0,,0.00
erj 145 jet seating chart american airlines,,0,,0.00
erj 145 twin jet seat chart,,0,,0.00
erj jet seating chart,,0,,0.00
erj-145 jet seating chart aeromexico,,0,,0.00
espn ny jets depth chart,,0,,0.00
espn.com team depth name nyjnew york jets depth chart espn,,0,,0.00
essendon jet charter,,0,,0.00
estimate of charter jet,,0,,0.00
ethiopian airlines boeing 777 200lr jet seating chart,,0,,0.00
etihad airbus industrie a332 jet seating chart,,0,,0.00
etihad boeing 777 300er jet seating chart,,0,,0.00
etihad jet airways redemption chart,,0,,0.00
etihad miles chart for jet airways,,0,,0.00
etsy jets eye chart,,0,,0.00
europe semi private jet charter,,0,,0.00
european jet charter,,0,,6.25
european jet stream chart,,0,,0.00
europes leading private jet charter,,0,,0.00
ev13 cam jetting chart,,0,,0.00
event jet charter,,0,,0.00
evinrude jet chart,,0,,0.00
evinrude outboard jet chart,,0,,0.00
evo jet charter,,0,,0.00
evojets private-jet-charter-flights-to-tor toronto private jet charter evojets,,0,,0.00
evry jet fighter aircraft chart,,0,,0.00
excecutive jet charter service,,0,,0.00
excel jet air charter,,0,,0.00
excel jet charts,,0,,0.00
execuitive jet charter,,0,,0.00
execujet bali jet charter,,0,,0.00
execujet berlin jet charter,,0,,0.00
execujet brussels jet charter,,0,,0.00
execujet cape town jet charter,,0,,0.00
execujet dubai international jet charter,,0,,0.00
execujet dubai south jet charter,,0,,0.00
execujet istanbul sabiha jet charter,,0,,0.00
execujet lagos jet charter,,0,,0.00
execujet melbourne jet charter,,0,,0.00
execujet monterrey jet charter,,0,,0.00
execujet new delhi jet charter,,0,,0.00
execujet paris jet charter,,0,,0.00
execujet st. gallen-altenrhein jet charter,,0,,0.00
execujet sydney jet charter,,0,,0.00
execujet wellington jet charter,,0,,0.00
execujet zurich jet charter,,0,,0.00
executive jet charter alberta,,0,,0.00
executive jet charter aspen,,0,,0.00
executive jet charter australia,,0,,0.00
executive jet charter bristol,,0,,0.00
executive jet charter broker,,0,,0.00
executive jet charter cheltenham,,0,,0.00
executive jet charter cincinnati,,0,,0.00
