Keyword,Intent,Volume,Keyword Difficulty,CPC (USD)
jets depth chart,Informational,49500,41,0.00
jets depth chart 2024,Informational,6600,67,0.00
new york jets depth chart,Informational,6600,46,0.00
ny jets depth chart,Informational,6600,45,0.00
private jet charter,Commercial,6600,66,2.99
jets qb depth chart,Informational,3600,36,0.00
charter private jet,Commercial,2400,66,2.99
jets wr depth chart,Informational,2400,40,0.00
private jet charter prices,Transactional,2400,42,1.57
private jet charter rates,Informational,2400,42,1.57
jet charter,Informational,1900,66,3.38
private jet charter cost,Informational,1900,46,1.57
private jet charter cost estimator,Informational,1900,45,1.27
private jet charter flights,Informational,1900,69,2.99
how much does it cost to charter a private jet,Informational,1600,51,1.11
how much to charter a private jet,Informational,1600,52,1.24
private jet charter services,Commercial,1600,77,3.52
charter a private jet,Commercial,1300,62,2.99
charter jet,Informational,1300,66,2.74
how much is it to charter a private jet,Informational,1300,48,1.24
jets rb depth chart,Informational,1300,47,0.00
u.s. fighter jets chart,Informational,1300,48,0.00
us fighter jets chart,Informational,1300,44,0.00
charter jet cost,Informational,1000,42,1.66
cost to charter a private jet,Informational,1000,53,1.12
how to charter a private jet,Informational,1000,37,2.39
jet charter flights,Informational,1000,69,3.38
jets depth chart 2023,Informational,1000,55,0.00
private jet charter dfw area,Commercial,1000,32,0.00
charter private jet cost,Informational,880,42,1.57
jets quarterback depth chart,Informational,880,34,0.00
new york jets depth chart 2024,Informational,880,50,0.00
new york jets wide receiver depth chart,Informational,880,43,0.00
private jet air charter,Informational,880,59,2.99
private jet charter aircraft,Informational,880,70,2.99
business jet charter rates,Informational,720,49,1.57
charter jets,Informational,720,69,2.74
jet charter companies,Informational,720,74,3.99
jets running back depth chart,Informational,720,38,0.00
jets wide receivers depth chart,Informational,720,39,0.00
new york jets wr depth chart,Informational,720,37,0.00
ny jets depth chart 2024,Informational,720,52,0.00
firearms on private charter jet,Informational,590,13,0.00
how much does a private jet charter cost,Informational,590,53,1.11
how much does it cost to charter a jet,Informational,590,50,1.09
how much to tip on a private jet charter,Informational,590,10,0.00
how much to tip on a private jet charter piolot,Informational,590,12,0.00
private jet charter near me,Transactional,590,33,3.48
sentient jet charter,Navigational,590,24,3.64
2007 honda shadow vt750c carburetor stock jet size chart,"Informational, Transactional",480,0,0.00
charter a jet,Informational,480,64,3.38
charter private jets,Informational,480,64,2.99
corporate jet charter rates,Commercial,480,55,1.57
jets roster 2024 depth chart,Informational,480,46,0.00
ny jets qb depth chart,Informational,480,38,0.00
ny jets wr depth chart,Informational,480,40,0.00
depth chart jets,Informational,390,41,0.00
jet aviation pj charter,Informational,390,33,0.00
new york jets qb depth chart,Informational,390,37,0.00
new york jets running back depth chart,Informational,390,36,0.00
private charter jets female ceos,Informational,390,17,0.00
private jet charter companies,Informational,390,65,3.95
private jet charter company,Informational,390,78,3.95
small [private jet charter,Informational,390,39,1.57
ameristar jet charter,Navigational,320,27,2.39
business jet charter cost,Informational,320,41,1.57
charter a private jet cost,Informational,320,47,1.57
charter jet service,Informational,320,75,4.40
corporate private jet charter,Informational,320,71,3.95
cost of private jet charter,Informational,320,45,1.57
cost private jet charter,Informational,320,46,1.57
jet charter cost,Informational,320,41,1.66
jets wide receiver depth chart,Informational,320,43,0.00
new york depth chart jets,Informational,320,43,0.00
nitrous jet chart,Informational,320,11,0.45
ny jets rb depth chart,Informational,320,43,0.00
affordable jet charter,Commercial,260,36,1.88
ameristar jet charter inc,Navigational,260,16,2.39
business jet charter,Informational,260,66,4.66
cost for private jet charter,Informational,260,50,1.57
cost of a private jet charter,Informational,260,46,1.57
cost to charter private jet,Informational,260,58,1.12
depth chart new york jets,Informational,260,45,0.00
empty leg jet charter,Commercial,260,32,1.29
how much is private jet charter,Informational,260,54,1.24
how much to charter private jet,Informational,260,50,1.24
jets te depth chart,Informational,260,37,0.00
new jets depth chart,Informational,260,40,0.00
nos jet chart,Informational,260,8,0.45
private charter jet,Commercial,260,61,2.99
private charter jet prices,Informational,260,56,1.57
private charter jets,Informational,260,68,2.99
private jet charter costs,Informational,260,41,1.57
what is a charter jet,Informational,260,32,1.38
worldwide jet charter,Navigational,260,18,3.47
air charter jet,Informational,210,65,3.38
amalfi jets - global private jet charter,Navigational,210,26,0.00
best private jet charter companies,Commercial,210,42,4.21
canadair regional jet seating chart,Informational,210,33,0.00
charter jet companies,Informational,210,69,3.99
charter jet flights,Informational,210,66,2.91
charter jet prices,Transactional,210,51,1.74
cheapest private jet charter,Informational,210,49,1.98
fmf jetting chart,Informational,210,9,0.00
holley jet size chart,Informational,210,6,0.00
how much to charter a jet,Informational,210,46,1.09
jet charter quote,Informational,210,44,5.78
jet's pizza redford charter twp mi,"Informational, Transactional",210,34,0.67
jets wr depth chart 2024,Informational,210,40,0.00
luxury jet charter,Informational,210,58,2.47
new york jets quarterback depth chart,Informational,210,41,0.00
nitrous express jet chart,"Informational, Navigational",210,6,0.15
private jet charter dallas,Commercial,210,38,3.99
private jet charter flight,Informational,210,60,2.99
private jet charter houston,Commercial,210,29,3.91
boeing 777 passenger jet seating chart,Informational,170,49,0.00
carb jet size chart,Informational,170,9,0.00
carburetor jet size chart,Informational,170,12,0.00
charter jets cost,"Informational, Transactional",170,48,1.66
charter private jet rates,Informational,170,45,1.57
cost charter private jet,Informational,170,48,1.57
cost of charter jet,"Informational, Transactional",170,45,1.66
cost to charter a jet,Informational,170,46,2.67
executive jet charter,Informational,170,38,4.02
hop-a-jet worldwide jet charter,Navigational,170,16,2.27
how much is it to charter a jet,Informational,170,50,1.09
jackson jet charter,Navigational,170,29,0.00
jet charter rates,Informational,170,41,1.74
jets 2024 depth chart,Informational,170,47,0.00
jets deprh chart,Informational,170,32,0.00
jets seating chart,Informational,170,44,0.88
nitrous outlet jet chart,Informational,170,10,0.80
nitrous oxide jet chart,Informational,170,10,0.45
private jet charter los angeles,Commercial,170,22,5.41
private jet charter miami,Commercial,170,24,6.56
private jet charter price,Transactional,170,45,1.57
private jet charter quote,Informational,170,32,5.08
private jet charter scottsdale,Commercial,170,18,4.64
private jets charter,Informational,170,67,4.38
private jets charter prices,Transactional,170,50,1.57
small jet charter,Informational,170,22,1.88
winnipeg jets depth chart,Informational,170,37,0.00
average cost of private jet charter,Informational,140,47,0.99
canadair jet seating chart,Informational,140,29,0.00
charter jet cost calculator,Informational,140,34,1.12
cheap jet charter,Informational,140,44,1.88
crj canadair regional jet seating chart,Informational,140,26,0.00
jet charter broker,Informational,140,40,5.18
jet depth chart,Informational,140,37,0.00
jet's pizza size chart,Informational,140,45,0.00
jets qb depth chart 2024,Informational,140,38,0.00
jets stadium seating chart,Informational,140,41,0.88
jets tight end depth chart,Informational,140,30,0.00
las vegas jet charter,Commercial,140,25,3.78
low cost private jet charter,Commercial,140,40,1.98
luxury private jet charter,Informational,140,69,3.16
most affordable private jet charter,Commercial,140,19,2.77
private charter jet cost,Informational,140,51,1.57
private jet charter chicago,Commercial,140,20,3.67
private jet charter houston tx,Commercial,140,29,3.91
private jet charter las vegas,Commercial,140,23,3.54
private jet charter new york,Commercial,140,26,3.94
private jets to charter,Informational,140,64,2.99
s&s super e jetting chart,Informational,140,2,0.00
atlanta private jet charter,Commercial,110,15,3.74
average cost to charter a private jet,Informational,110,52,0.99
boeing business jet charter,Informational,110,33,1.71
book charter jet,Informational,110,65,3.84
business jet charter dallas,"Informational, Commercial",110,39,3.99
carburetor jetting chart,Informational,110,15,0.00
charter jet company,Informational,110,69,3.99
charter jet price,Transactional,110,45,1.74
charter jet services,Informational,110,65,4.40
charter private jet dallas,Commercial,110,34,3.99
charter private jet las vegas,Informational,110,24,3.54
corporate jet charter,Informational,110,75,4.05
embraer 175 jet seating chart,Informational,110,48,0.00
fmf jet chart,Informational,110,8,0.00
honda jet charter,Commercial,110,9,2.40
honda jet charter cost,Informational,110,19,1.32
hop a jet worldwide jet charter,Navigational,110,13,2.27
hop-a-jet charter,Navigational,110,16,5.60
houston jet charter,Commercial,110,26,3.98
jd jetting chart,Informational,110,0,0.00
jet charter flight,Informational,110,65,3.38
jet charter la,Commercial,110,20,3.85
jet charter los angeles,Commercial,110,26,3.85
jet charter scottsdale,Commercial,110,20,5.82
jet charter services,Commercial,110,64,4.40
jet private charter,Informational,110,62,2.99
jet's pizza brownstown charter twp mi,"Informational, Transactional",110,25,0.39
jets depth chart 2022,Informational,110,42,0.00
jets roster 2023 depth chart,Informational,110,37,0.00
la jet charter,Informational,110,21,3.85
light jet charter,Informational,110,18,2.36
metlife stadium seating chart jets,Informational,110,45,0.88
new york jets roster 2024 depth chart,Informational,110,45,0.00
new york private jet charter,Informational,110,24,3.94
nos fogger jet chart,Informational,110,2,0.00
private jet charter cheap,Informational,110,51,1.98
private jet charter fort lauderdale,Commercial,110,16,6.70
private jet charter in las vegas,Commercial,110,25,3.54
private jet charter membership,Informational,110,35,3.15
private jet charter nyc,Commercial,110,23,3.94
private jet charter seattle,Informational,110,28,2.43
private jet charter to vegas,Informational,110,22,3.54
private jet for charter,Informational,110,66,2.99
private jets for charter,Informational,110,66,2.99
shared jet charter,Commercial,110,38,1.87
stratos jet charter,Navigational,110,34,4.74
vegas jet charter,Informational,110,27,3.78
villiers jet charter,Navigational,110,29,1.03
amalfi private jets - global private jet charter,Navigational,90,22,2.26
best private jet charter,Commercial,90,46,3.76
business charter jet,Informational,90,57,4.66
carb jetting chart,Informational,90,10,0.00
charter a business jet,Informational,90,66,2.42
charter a jet cost,"Informational, Transactional",90,48,1.66
charter a private jet price,Transactional,90,46,1.12
charter jet airlines,Navigational,90,59,3.60
charter jet bahamas,Informational,90,29,3.12
charter jet one,"Informational, Navigational",90,38,2.13
charter private jet miami,Informational,90,24,6.56
cheap private jet charter,Informational,90,44,1.98
chicago private jet charter flights,Informational,90,24,3.67
cost of jet charter,Informational,90,45,1.66
cost to charter jet,Informational,90,45,1.66
hop a jet worldwide charter,Navigational,90,14,5.60
how much is a private jet charter,Informational,90,54,1.24
jet blue seating chart,"Informational, Transactional",90,52,0.00
jet charter dallas,Commercial,90,32,4.90
jet charter dallas tx,Commercial,90,30,3.82
jet charter flights houston,Informational,90,29,3.98
jet charter flights seattle,Commercial,90,27,2.66
jet charter houston,Commercial,90,27,6.17
jet charter houston tx,Commercial,90,26,3.98
jet charter scottsdale az,Informational,90,17,5.82
jet charter service,Informational,90,72,4.40
jet diver depth chart,Informational,90,3,0.00
jet's pizza commerce charter twp mi,"Informational, Transactional",90,30,0.60
jets 2023 depth chart,Informational,90,39,0.00
jets depth charts,Informational,90,32,0.00
jets dpeth chart,Informational,90,29,0.00
miami charter jet,Informational,90,26,4.65
mikuni main jet size chart,"Informational, Commercial",90,0,0.00
new york jets seating chart,Informational,90,38,1.07
nitrous fogger jet chart,Informational,90,1,0.00
ny jets metlife stadium seating chart,Informational,90,45,0.88
ny jets seating chart,Informational,90,38,1.07
premier-private-jet-charter,Informational,90,23,0.00
price charter jet,Transactional,90,47,1.03
private jet charter atlanta,Commercial,90,16,3.74
private jet charter atlanta ga,Commercial,90,15,3.74
private jet charter boston,Commercial,90,22,3.92
private jet charter broker,Informational,90,52,4.88
private jet charter cost estimator usa,Informational,90,42,2.41
private jet charter denver,Commercial,90,20,6.65
private jet charter flights las vegas,Informational,90,33,3.54
private jet charter jobs,Commercial,90,20,0.96
private jet charter orlando,Commercial,90,21,4.13
private jet charter scottsdale az,Commercial,90,17,4.64
private jet charter service,Informational,90,74,3.52
s&s super e jet chart,Informational,90,0,0.00
tee jet nozzle chart,Informational,90,14,2.57
tri state jet charter,Informational,90,2,4.13
what does it cost to charter a private jet,Informational,90,49,1.39
affordable private jet charter,Informational,70,40,3.06
american jet charter,Navigational,70,24,3.00
bbr jetting chart,Informational,70,0,0.00
berkeley jet pump hp chart,Informational,70,0,0.00
best jet charter,Commercial,70,41,3.47
best jet charter company,Commercial,70,51,5.33
boise jet charter,Commercial,70,15,2.41
boston private jet charter flights,Informational,70,18,3.92
charter jet florida,Informational,70,45,7.54
charter jet membership,Informational,70,35,3.23
charter jet rental,Informational,70,66,2.13
charter jets near me,"Informational, Transactional",70,16,3.89
exec jet charter,Informational,70,37,4.02
florida jet charter,Informational,70,32,7.54
harley cv carb jet chart,Informational,70,4,0.00
harley cv carb jetting chart,Informational,70,0,0.00
holley jet chart,Informational,70,7,0.00
holley nitrous jet chart,Informational,70,11,0.00
holley nos jet chart,"Informational, Transactional",70,15,0.00
induction solutions fogger jet chart,Informational,70,0,0.00
international jet charter,"Informational, Transactional",70,7,2.80
jet charter boise,Commercial,70,15,2.41
jet charter cleveland,Commercial,70,15,2.86
jet charter flights atlanta,Commercial,70,12,3.78
jet charter miami,Commercial,70,20,4.65
jet charter prices,Transactional,70,40,1.74
jet charter san diego,Commercial,70,14,3.24
jet charter usa,Informational,70,63,3.00
jet fuel price chart,Navigational,70,42,3.18
jet size chart,Informational,70,10,0.00
jet sizing chart,Informational,70,11,0.00
jet's pizza union lake road commerce charter township mi,"Informational, Transactional",70,20,0.00
jets charter,Informational,70,69,3.38
jets defense depth chart,Informational,70,41,0.00
jets deoth chart,Informational,70,27,0.00
jets o line depth chart,Informational,70,35,0.00
jets qb depth chart 2023,Informational,70,42,0.00
jetting chart,Informational,70,1,0.00
jetting size chart,Informational,70,14,0.00
keihin main jet size chart,"Informational, Commercial",70,9,0.00
last minute jet charter,Commercial,70,22,2.79
medevac private jet charter,Informational,70,17,2.05
miami jet charter,Informational,70,25,6.65
minneapolis jet charter,Commercial,70,6,2.95
n y jets depth chart,Informational,70,35,0.00
nibbi carburetor jetting chart,Informational,70,17,0.00
nitrous express jetting chart,"Informational, Navigational",70,10,0.15
nitrous jet chart wet,Informational,70,4,0.00
nitrous jet size chart,Informational,70,5,0.00
nos jet size chart,Informational,70,5,0.00
ny jets depth chart 2023,Informational,70,43,0.00
phoenix jet charter,Commercial,70,22,3.30
predator 212 jet size chart,Informational,70,0,0.00
price to charter a private jet,Transactional,70,49,1.50
private charter jet service,Informational,70,68,3.52
private jet charter careers,Commercial,70,25,0.96
private jet charter denver co,Informational,70,21,6.65
private jet charter la,Commercial,70,26,5.41
private jet charter san diego,Commercial,70,14,6.79
private jet charter seattle wa,Commercial,70,25,2.43
pro circuit jetting chart,"Informational, Navigational",70,6,0.00
russian fighter jets chart,Informational,70,47,0.00
t jet nozzles chart,"Informational, Transactional",70,8,1.49
top 10 private jet charter companies,Commercial,70,10,3.23
us jet charter,Informational,70,66,3.00
vision jet charter,Informational,70,7,2.61
wet nitrous jet chart,Informational,70,1,0.00
x jet proportioner chart,Informational,70,0,0.00
yz250 jetting chart,Informational,70,4,0.00
2023 jets depth chart,Informational,50,38,0.00
2024 jets depth chart,Informational,50,41,0.00
alpha jet charter,Navigational,50,16,2.72
athletics private jet charter,Informational,50,9,0.00
banshee jetting chart,Informational,50,0,0.00
best charter jet service,Commercial,50,40,4.97
carburetor main jet size chart,Informational,50,15,0.00
charter jet to las vegas,Informational,50,25,2.18
charter jet transport,Navigational,50,11,2.35
charter jets prices,Transactional,50,44,1.74
cheapest charter jet,Commercial,50,38,1.88
cheapest jet charter,Informational,50,39,1.88
cirrus vision jet charter,Informational,50,4,2.09
dallas private jet charter,Commercial,50,33,3.99
drill bit to jet size chart,Informational,50,2,0.00
espn jets depth chart,Navigational,50,61,0.00
europe private jet charter,Informational,50,54,3.60
hawaii jet charter,Informational,50,18,2.25
holley jet sizes chart,Informational,50,5,0.00
holley main jet size chart,Informational,50,4,0.00
induction solutions fogger jetting chart,Informational,50,0,0.00
international private jet charter,Commercial,50,50,2.90
jet charter cancun,Informational,50,8,2.13
jet charter chicago,Commercial,50,27,8.55
jet charter company,Informational,50,69,3.99
jet charter membership,Informational,50,30,3.23
jet charter price,Transactional,50,44,1.74
jet charter pricing,Transactional,50,44,1.74
jet charter sales jobs,Commercial,50,16,0.54
jet charter tampa,Commercial,50,13,4.76
jet charter to las vegas,Informational,50,22,2.18
jet fuel prices chart,Navigational,50,43,3.18
jet's pizza large size chart,Informational,50,35,0.00
jet's pizza shelby charter township mi,Transactional,50,29,0.09
jets cb depth chart,Informational,50,38,0.00
jets espn depth chart,Navigational,50,52,0.00
jets metlife stadium seating chart,Informational,50,44,0.88
jets offensive depth chart,Informational,50,38,0.00
jets offensive line depth chart,Informational,50,36,0.00
jets roster depth chart,Informational,50,44,0.00
klx 110 jet chart,Informational,50,0,0.00
klx 110 jetting chart,Informational,50,0,0.00
klx110 jetting chart,Informational,50,0,0.00
las vegas private jet charter,Commercial,50,31,3.54
last minute private jet charter,Commercial,50,21,11.47
los angeles jet charter,Informational,50,22,3.85
metlife jets seating chart,Informational,50,44,0.93
metlife seating chart jets,Informational,50,38,0.93
miami private jet charter,Commercial,50,22,6.56
mikuni needle jet chart,Informational,50,0,0.00
mikuni pilot jet size chart,Informational,50,0,0.00
new york jets 2024 depth chart,Informational,50,40,0.00
new york jets depth chart 2023,Informational,50,38,0.00
nj jets depth chart,Informational,50,50,0.00
nos jet chart fogger,Informational,50,8,0.00
nos nitrous jet chart,Informational,50,3,0.00
on demand jet charter,Informational,50,30,2.73
pilot jet size chart,Informational,50,9,0.00
privat jet charter,Informational,50,61,2.99
private charter jet companies,Commercial,50,77,3.95
private jet charter austin,Commercial,50,9,5.45
private jet charter cost calculator,Informational,50,37,0.85
private jet charter europe,Informational,50,60,3.60
private jet charter nashville,Commercial,50,28,4.53
private jet charter opa locka,Commercial,50,10,6.28
private jet charter pricing,Transactional,50,44,1.57
private jet charter to europe,Informational,50,45,3.60
private jet charter van nuys,Commercial,50,19,5.03
private jet charter west palm beach,Commercial,50,15,16.84
private jet comparison chart,"Informational, Commercial",50,12,2.62
provate jet charter,Commercial,50,61,2.99
scubapro jet fins size chart,Informational,50,9,0.93
tavaero jet charter,Navigational,50,30,3.51
2 stroke jetting chart,Informational,40,3,0.00
2022 jets depth chart,Informational,40,37,0.00
average cost for private jet charter,Informational,40,51,0.99
bahamas private jet charter,Informational,40,16,4.80
best jet charter companies,Commercial,40,22,5.33
carb main jet size chart,Informational,40,14,0.00
charter corporate jet,Informational,40,66,3.10
charter jet austin,Commercial,40,17,4.15
charter jet dallas,Commercial,40,34,4.90
charter jet india,Commercial,40,31,2.07
charter jet prices per hour,Transactional,40,46,1.28
charter jet pricing,Transactional,40,43,1.74
charter jet to vegas,Informational,40,31,2.93
colorado jet charter,Commercial,40,19,3.37
dallas jet charter,Commercial,40,33,4.90
delta charter jet,Informational,40,40,2.00
fmf jetting chart yz250,Informational,40,3,0.00
fractional jet ownership vs charter,Commercial,40,1,7.11
heavy jet charter,Informational,40,17,2.24
high altitude jetting chart,Informational,40,0,0.00
honda 400ex jetting chart,Informational,40,0,0.00
honda carburetor jet size chart,Informational,40,0,0.00
horse racing private jet charter,Informational,40,6,0.00
houston private jet charter,Commercial,40,23,3.91
how much to charter jet,Informational,40,38,1.09
jet charter costs,Informational,40,45,1.66
jet charter las vegas,Commercial,40,26,3.78
jet charter panama,Informational,40,10,3.11
jet charter rates per hour,Informational,40,38,1.28
jet charter sacramento,Commercial,40,22,4.07
jet diver chart,Informational,40,1,0.00
jet diver dive chart,Informational,40,3,0.00
jet's pizza brownstown charter township menu,"Informational, Transactional",40,24,0.00
jets backup qb depth chart,Informational,40,45,0.00
jets dept chart,Informational,40,32,0.00
jets depth chart 2024 espn,Navigational,40,74,0.00
jets depth chart ourlads,Navigational,40,44,0.00
jets nfl depth chart,Informational,40,40,0.00
jets offense depth chart,Informational,40,29,0.00
jets projected depth chart,Informational,40,27,0.00
jets receiver depth chart,Informational,40,41,0.00
jets running backs depth chart,Informational,40,35,0.00
keihin carb jetting chart,Informational,40,20,0.00
keihin pilot jet size chart,Informational,40,3,0.00
los angeles private jet charter,Informational,40,26,6.66
luxury jets charter,"Informational, Commercial",40,68,2.47
main jet size chart,Informational,40,13,0.00
mikuni jet size chart,Informational,40,0,0.00
music tour private jet charter,Informational,40,10,0.00
new york jets rb depth chart,Informational,40,34,0.00
new york.jets depth chart,Informational,40,46,0.00
nfl jets depth chart,Informational,40,45,0.00
nos big shot jet chart,Informational,40,0,0.00
nos jetting chart,Informational,40,3,0.45
oceania private jet charter,Informational,40,2,0.00
one way jet charter,Informational,40,22,4.91
private jet charter austin tx,Commercial,40,12,5.45
private jet charter calculator,Informational,40,26,1.17
private jet charter cost per hour,Informational,40,38,1.67
private jet charter dubai,Commercial,40,20,3.21
private jet charter indianapolis,Commercial,40,18,3.35
private jet charter international travel,Informational,40,62,2.90
private jet charter london,Commercial,40,17,4.22
private jet charter minneapolis,Commercial,40,7,2.72
private jet charter palm beach,Commercial,40,20,7.51
private jet charter tampa,Commercial,40,11,5.73
private jet charter to new york,Informational,40,19,3.94
private jet charter uk,Informational,40,42,13.76
tee jet tip chart,"Informational, Transactional",40,9,2.85
texans depth chart vs jets,Commercial,40,61,0.00
weber 32/36 jetting chart,Informational,40,0,0.00
wisconsin jet charter,Informational,40,8,2.32
zex nitrous jet chart,Informational,40,0,0.00
32/36 weber jetting chart,Informational,30,0,0.00
american football private jet charter,Informational,30,0,0.00
aspen jet charter,Informational,30,19,4.61
austin jet charter,Informational,30,14,4.15
basketball private jet charter,Informational,30,1,0.00
book a charter jet,Informational,30,,3.84
carburetor jet sizes chart,Informational,30,14,0.00
charlotte jet charter,Commercial,30,6,3.84
charter a fighter jet,Commercial,30,32,0.00
charter a jet miami,Commercial,30,22,6.65
charter a jet price,Transactional,30,43,1.03
charter a retired fighter jet,Informational,30,23,0.00
charter executive jet,Informational,30,45,0.00
charter jet broker,Informational,30,43,5.10
charter jet cost estimate,Informational,30,39,1.70
charter jet cost per hour,Informational,30,48,1.28
charter jet costs,Informational,30,36,1.66
charter jet international,Informational,30,47,2.80
charter jet seattle,Informational,30,21,2.66
charter private jet houston,Commercial,30,27,3.91
chicago private jet charter,Informational,30,24,3.67
cirrus jet charter,Informational,30,8,2.63
commercial jet charter,Informational,30,28,4.55
cricket private jet charter,Commercial,30,0,0.00
dry nitrous jet chart,Informational,30,0,0.00
dubai charter jet,Commercial,30,17,0.00
e85 jetting chart,Informational,30,1,0.00
e85 nitrous jet chart,Informational,30,0,0.00
fmf jetting chart yz125,Informational,30,0,0.00
group jet charter,Informational,30,26,4.58
holley carb jet size chart,Informational,30,8,0.00
