Keyword,Intent,Volume,Keyword Difficulty,CPC (USD)
jets depth chart week 13,,0,,0.00
jets depth chart week 14,,0,,0.00
jets depth chart week 3,,0,,0.00
jets depth chart week 8,,0,,0.00
jets depth chart with numbers,,0,,0.00
jets depth chart yahoo,,0,,0.00
jets depth chart.,,0,,0.00
jets depth. chart,,0,,0.00
jets depthc chart,,0,,0.00
jets deptj chart,,0,,0.00
jets doeth chart,,0,,0.00
jets drpth chart,,0,,0.00
jets dwpth chart,,0,,0.00
jets eye chart,,0,,0.00
jets fantasy depth chart,,0,,0.00
jets fepth chart,,0,,0.00
jets final depth chart,,0,,0.00
jets first depth chart,,0,,0.00
jets football stadium seating chart,,0,,0.00
jets football team depth chart,,0,,0.00
jets giants stadium seating chart,,0,,0.00
jets goalie depth chart,,0,,0.00
jets hall of fame game depth chart,,0,,0.00
jets kicker depth chart,,0,,0.00
jets line depth chart,,0,,0.00
jets linebacker depth chart,,0,,0.00
jets ol depth chart,,0,,0.00
jets past depth chart,,0,,0.00
jets pizza size chart,,0,,0.00
jets pizza size comparison chart,,0,,0.00
jets post draft depth chart,,0,,0.00
jets projected depth chart 2021,,0,,0.00
jets projected depth chart 2023,,0,,0.00
jets qb 2013 depth chart,,0,,0.00
jets qb 2014 depth chart,,0,,0.00
jets qb 2015 depth chart,,0,,0.00
jets qb 2017 depth chart,,0,,0.00
jets qb 2018 depth chart,,0,,0.00
jets qb 2021 depth chart,,0,,0.00
jets qb deprh chart,,0,,0.00
jets qb dept chart,,0,,0.00
jets qb depth chart 2011,,0,,0.00
jets qb depth chart 2012,,0,,0.00
jets qb depth chart 2013,,0,,0.00
jets qb depth chart 2014,,0,,0.00
jets qb depth chart 2015,,0,,0.00
jets qb depth chart 2016,,0,,0.00
jets qb depth chart 2017,,0,,0.00
jets qb depth chart 2018,,0,,0.00
jets qb depth chart 2019,,0,,0.00
jets qb depth chart 2020,,0,,0.00
jets qb depth chart 2021,,0,,0.00
jets qb depth chart practice squad,,0,,0.00
jets qb depth chart tonight,,0,,0.00
jets quarterback 2015 depth chart,,0,,0.00
jets quarterback 2017 depth chart,,0,,0.00
jets quarterback 2018 depth chart,,0,,0.00
jets quarterback 2021 depth chart,,0,,0.00
jets quarterback depth chart 2015,,0,,0.00
jets quarterback depth chart 2017,,0,,0.00
jets quarterbacks 2012 depth chart,,0,,0.00
jets quarterbacks 2013 depth chart,,0,,0.00
jets quarterbacks 2014 depth chart,,0,,0.00
jets quarterbacks 2023 depth chart,,0,,0.00
jets rb chart,,0,,0.00
jets rb depth chart 2013,,0,,0.00
jets rb depth chart 2015,,0,,0.00
jets rb depth chart 2016,,0,,0.00
jets rb depth chart 2017,,0,,0.00
jets rb depth chart 2018,,0,,0.00
jets rb depth chart 2019,,0,,0.00
jets rb depth chart 2020,,0,,0.00
jets rb depth chart starters,,0,,0.00
jets receivers 2023 depth chart,,0,,0.00
jets receivers depth chart,,0,,0.00
jets receiving depth chart,,0,,0.00
jets roster 2015 depth chart,,0,,0.00
jets roster 2016 depth chart,,0,,0.00
jets roster 2018 depth chart,,0,,0.00
jets roster 2019 depth chart,,0,,0.00
jets roster 2020 depth chart,,0,,0.00
jets roster depth chart 2019,,0,,0.00
jets roster nfl depth chart,,0,,0.00
jets running back 2013 depth chart,,0,,0.00
jets running back deph chart,,0,,0.00
jets running back depth chart 2012,,0,,0.00
jets running back depth chart 2014,,0,,0.00
jets running back depth chart 2015,,0,,0.00
jets running back depth chart 2017,,0,,0.00
jets running back depth chart 2018,,0,,0.00
jets running back depth chart 2019,,0,,0.00
jets running back depth chart 2020,,0,,0.00
jets running back depth chart 2021,,0,,0.00
jets running back depth chart 2022,,0,,0.00
jets running back depth chart 2023,,0,,0.00
jets running backs 2015 depth chart,,0,,0.00
jets running backs 2017 depth chart,,0,,0.00
jets running backs 2018 depth chart,,0,,0.00
jets running backs 2020 depth chart,,0,,0.00
jets running backs 2021 depth chart,,0,,0.00
jets running backs 2023 depth chart,,0,,0.00
jets running backs 2024 depth chart,,0,,0.00
jets safety depth chart,,0,,0.00
jets season 2017 playing chart,,0,,0.00
jets season 2017 playing chart snap,,0,,0.00
jets seating chart metlife,,0,,0.00
jets seating chart mts centre,,0,,0.00
jets seating chart prices,,0,,0.00
jets seating chart suites,,0,,0.00
jets seating chart vi,,0,,0.00
jets secondary depth chart,,0,,0.00
jets septh chart,,0,,0.00
jets size chart,,0,,0.00
jets size chart for johnson outboard carburator,,0,,0.00
jets special teams depth chart,,0,,0.00
jets stadium interactive seating chart,,0,,0.00
jets stadium seating chart 3d,,0,,0.00
jets stadium seating chart 3d view,,0,,0.00
jets stadium seating chart suites,,0,,0.00
jets strength chart,,0,,0.00
jets te depth chart 2022,,0,,0.00
jets to charter,,0,,0.00
jets too early depth chart,,0,,0.00
jets training camp seating chart,,0,,0.00
jets virtual stadium seating chart,,0,,0.00
jets vs bills depth chart,,0,,0.00
jets vs browns depth chart,,0,,0.00
jets wb depth chart,,0,,0.00
jets week 1 depth chart,,0,,0.00
jets week 2 depth chart,,0,,0.00
jets week 3 depth chart,,0,,0.00
jets week 7 depth chart,,0,,0.00
jets week 9 depth chart,,0,,0.00
jets wide receiver depth chart 2017,,0,,0.00
jets wide receivers 2017 depth chart,,0,,0.00
jets wide receivers 2018 depth chart,,0,,0.00
jets wide receivers 2023 depth chart,,0,,0.00
jets wide reciever depth chart,,0,,0.00
jets winnipeg depth chart,,0,,0.00
jets wr 2017 depth chart,,0,,0.00
jets wr chart,,0,,0.00
jets wr deprh chart,,0,,0.00
jets wr depth chart 2010,,0,,0.00
jets wr depth chart 2011,,0,,0.00
jets wr depth chart 2012,,0,,0.00
jets wr depth chart 2014,,0,,0.00
jets wr depth chart 2015,,0,,0.00
jets wr depth chart 2016,,0,,0.00
jets wr depth chart 2018,,0,,0.00
jets wr depth chart 2020,,0,,0.00
jets wr depth chart fantasy,,0,,0.00
jets.depth.chart,,0,,0.00
jetsmarter private jets charter,,0,,0.00
jetting 1998 a ktm 300 exc chart,,0,,0.00
jetting chart 2003 polaris xc 600,,0,,0.00
jetting chart 700 triple mountain max,,0,,0.00
jetting chart altitude,,0,,0.00
jetting chart fmf,,0,,0.00
jetting chart fmf crf150f,,0,,0.00
jetting chart for 2008 triumph t100 865,,0,,0.00
jetting chart for holley,,0,,0.00
jetting chart for polaris,,0,,0.00
jetting chart for polaris tx400,,0,,0.00
jetting chart for ski doo,,0,,0.00
jetting chart for suzuki needles,,0,,0.00
jetting chart for yamaha banshee,,0,,0.00
jetting chart for yfz450,,0,,0.00
jetting chart for yz,,0,,0.00
jetting chart for yz125,,0,,0.00
jetting chart for yz250,,0,,0.00
jetting chart ktm 300 xc,,0,,0.00
jetting chart ktm 65,,0,,0.00
jetting chart mikuni,,0,,0.00
jetting chart moped army,,0,,0.00
jetting chart nitrous outlet,,0,,0.00
jetting chart rotax max,,0,,0.00
jetting chart trx450r,,0,,0.00
jetting elevation chart,,0,,0.00
jetting mikuni carb charts,,0,,0.00
jetting nos big shot jet chart,,0,,0.00
jetting temperature chart,,0,,0.00
jfk jet charter,,0,,0.00
jim hensley american jet charter,,0,,0.00
jobs in private jet charter,,0,,0.00
jobs private jet charter,,0,,0.00
jody jazz super jet size chart,,0,,0.00
johannesburg jet charter,,0,,0.00
john deere charter jet,,0,,0.00
john deere classic charter jet,,0,,0.00
john wayne airport jet charter,,0,,0.00
js ventures houston charter jet company,,0,,0.00
jsx jet charter,,0,,0.00
jsx private jet charter,,0,,0.00
jumbo jet charter companies,,0,,0.00
jumbo jet charter price,,0,,0.00
jumbo jet charter rates,,0,,0.00
jumbo jet seating chart,,0,,0.00
jump flew on a charter jet with jeffrey epstein,,0,,0.00
kamloops jet charter,,0,,0.00
kansas city missouri jet charter,,0,,0.00
kansas city private jet charter,,0,,2.53
kansas jet charter,,0,,0.00
kansas private jet charter,,0,,0.00
kawasaki jet ski spark plug gap chart,,0,,0.00
kawasaki kx100 jetting chart,,0,,0.00
kbfi jet charter,,0,,0.00
kdal jet charter,,0,,0.00
kdpa jet charter,,0,,0.00
kdx 220 jetting chart,,0,,0.00
kdx jetting chart,,0,,0.00
kdx200 jetting chart,,0,,0.00
keflavk jet charter,,0,,0.00
kehien jet chart,,0,,0.00
keihin altitude jetting chart,,0,,0.00
keihin carb jet chart,,0,,0.00
keihin carburetor jet chart,,0,,0.00
keihin carburetor jet size chart & kohler command,,0,,0.00
keihin carburetor jet size chart+ kohler command,,0,,0.00
keihin carburetor jet sizing chart,,0,,0.00
keihin carburetor main jet size chart,,0,,0.00
keihin carburetor tuning jetting chart,,0,,0.00
keihin cv harley cv carb jetting chart,,0,,0.00
keihin cv jet needle chart,,0,,0.00
keihin cvk 32 jet size chart,,0,,0.00
keihin cvk 32 ural jet size chart,,0,,0.00
keihin elevation jetting chart,,0,,0.00
keihin fcr jet chart,,0,,0.00
keihin fcr jet needle chart,,0,,0.00
keihin fcr needle jet chart,,0,,0.00
keihin fcr41 altitude jetting chart,,0,,0.00
keihin jet needles chart,,0,,0.00
keihin jet size chart 42,,0,,0.00
keihin jet size chart drill,,0,,0.00
keihin jets size chart,,0,,0.00
keihin main jet elevation chart,,0,,0.00
keihin main jet sizes chart,,0,,0.00
keihin pilot jet size chart adjustment screw,,0,,0.00
keihin pilot stock jet chart,,0,,0.00
keihin pj jetting chart,,0,,0.00
keihin pwk carb jet size chart,,0,,0.00
keihin pwk jet needle chart,,0,,0.00
keihin pwk needle jet chart,,0,,0.00
keihin to dynojet pilot jet conversion chart,,0,,0.00
keihin vs mikuni pilot jet size chart,,0,,0.00
keihn elevation jetting chart,,0,,0.00
keinin jet chart,,0,,0.00
kentucky derby private jet charter,,0,,0.00
kenya jet charter,,0,,0.00
kenya private jet charter,,0,,0.00
ketchikan jet charter,,0,,0.00
key air jet charter,,0,,0.00
key jet charter,,0,,0.00
key west jet charter,,0,,0.00
kfhb charter jets,,0,,0.00
kfx 700 jetting chart,,0,,0.00
khpn jet charter,,0,,0.00
khya jet charter,,0,,0.00
kim kardashian private jet charter,,0,,0.00
king air jet charter,,0,,0.00
kism jet charter,,0,,0.00
kissimmee jet charter,,0,,0.00
kjr aviation private jet charter,,0,,0.00
klgb jet charter,,0,,0.00
klm a333 jet seating chart,,0,,0.00
klr 650 jetting chart elevation,,0,,0.00
klx250 jetting chart,,0,,0.00
kmdt charter jet,,0,,0.00
knauf jet stream chart,,0,,0.00
knauf jet stream r value chart,,0,,0.00
knights jets pregame show charter,,0,,0.00
knoxville jet charter,,0,,0.00
knoxville tn jet charter,,0,,0.00
kobe jet pump orifice size chart,,0,,0.00
korean air seating chart boeing 777 300er jet,,0,,0.00
korh jet charter,,0,,0.00
koury aviation private jet charter,,0,,0.00
kpsm jet charter,,0,,0.00
kptk jet charter,,0,,0.00
ksdl jet charter,,0,,0.00
ksna jet charter,,0,,0.00
ksp jet engine efficiency chart,,0,,0.00
ksrq jet charter,,0,,0.00
ktm 105 jetting chart,,0,,0.00
ktm 150 jetting chart,,0,,0.00
ktm 150 sx jetting chart,,0,,0.00
ktm 2 stroke jetting chart,,0,,0.00
ktm 250 exc jetting chart,,0,,0.00
ktm 250 jetting chart,,0,,0.00
ktm 250 xc jetting chart,,0,,0.00
ktm 250sx jetting chart,,0,,0.00
ktm 300 jetting chart by elevation,,0,,0.00
ktm 380 jetting chart,,0,,0.00
ktm 525 exc jetting chart,,0,,0.00
ktm 525 jetting chart,,0,,0.00
ktm 530 jetting chart,,0,,0.00
ktm 65 sx jetting chart,,0,,0.00
ktm 85 jet chart,,0,,0.00
ktm jet correction chart,,0,,0.00
ktm jet needle chart,,0,,0.00
ktm jetting charts,,0,,0.00
kuta jet charter,,0,,0.00
kvny jet charter,,0,,1.53
kx 125 fmf jetting chart,,0,,0.00
kx 65 jetting chart,,0,,0.00
kx 85 jetting chart,,0,,0.00
kx112 jetting chart,,0,,0.00
kx250 jetting chart,,0,,0.00
kx500 jetting chart altitude,,0,,0.00
kx65 jd jetting chart,,0,,0.00
kx65 needle jet chart,,0,,0.00
kx80 main jet size chart,,0,,0.00
la jolla private jet charter,,0,,0.00
la to vegas jet charter,,0,,0.00
lagos jet charter,,0,,0.00
lajes jet charter,,0,,0.00
lake charles to houston charter jet,,0,,0.00
large cabin private jet charter,,0,,0.00
large charter jet,,0,,0.00
large charter jets,,0,,0.00
large group jet charter,,0,,0.00
large jet charter rates,,0,,0.00
largest charter jet,,0,,0.00
largest charter jet companies,,0,,0.00
largest private jet charter company,,0,,0.00
las vegas charter jet,,0,,3.78
las vegas charter jet llc,,0,,0.00
las vegas charter private jet,,0,,0.00
las vegas charter private jet flights,,0,,0.00
las vegas jet charter careers,,0,,0.00
las vegas jet charter flight attendant,,0,,0.00
las vegas jet charter flight attendant salary,,0,,0.00
las vegas jet charter jobs,,0,,0.00
las vegas jet charter llc,,0,,0.00
las vegas jet charter private jet,,0,,0.00
las vegas jet charter reviews,,0,,0.00
las vegas jet charter salary,,0,,0.00
last minute jet charter deals,,0,,0.00
lax jet charter,,0,,3.26
lax private jet charter,,0,,0.00
lax private jet charter to asia,,0,,0.00
lax to sacramento charter jet,,0,,0.00
lbbg jet charter,,0,,0.00
lbsf jet charter,,0,,0.00
leading charter jet service,,0,,0.00
leading jet charter service,,0,,0.00
leading private jet charter companies,,0,,0.00
leap jet engine price chart,,0,,0.00
lear jet 45 charter van nuys,,0,,0.00
lear jet charter 787,,0,,0.00
lear jet charter cost,,0,,0.00
lear jet charter lake havasu to hillsboro,,0,,0.00
lear jet corporate charter servvice at sna,,0,,0.00
leasing my jet to a charter,,0,,0.00
leasing my private jet to a charter operator,,0,,0.00
least expensive charter jet to bring dog usa to europe,,0,,0.00
least expensive jet charter,,0,,0.00
lebl jet charter,,0,,0.00
lech austria jet charter,,0,,0.00
leco jet charter,,0,,0.00
leer jet charter,,0,,0.00
leesburg jet charter,,0,,0.00
legal private jet charter,,0,,0.00
lege jet charter,,0,,0.00
leib jet charter,,0,,0.00
lemd jet charter,,0,,0.00
lemg jet charter,,0,,0.00
lepa jet charter,,0,,0.00
lest jet charter,,0,,0.00
levaldigi jet charter,,0,,0.00
levc jet charter,,0,,0.00
lfmd jet charter,,0,,0.00
lfpb jet charter,,0,,0.00
lftz jet charter,,0,,0.00
light charter jet,,0,,0.00
light jet charter cost per hour,,0,,0.00
light jet charter dallas,,0,,0.00
light jet charter hourly rates,,0,,0.00
light jet charter los angeles,,0,,3.85
light jet charter san diego,,0,,0.00
light jet charter seattle,,0,,0.00
light jet charter southern california,,0,,0.00
lima charter jets,,0,,0.00
lima peru jet charter,,0,,0.00
limz jet charter,,0,,0.00
lisboa jet charter,,0,,0.00
list of private jet charter companies in india,,0,,0.00
litchfield jet charter,,0,,0.00
litres to usg jet a1 chart,,0,,0.00
liv charter jet,,0,,0.00
liv golf charter jet,,0,,0.00
lloyd aviation jet charter australia,,0,,0.00
lloyd aviation jet charter pty ltd,,0,,0.00
local jet charter,,0,,0.00
locating the jet stream on a 300 mb chart,,0,,0.00
logo jets charter,,0,,0.00
london charter jet,,0,,6.38
london executive jet charter,,0,,0.00
london ontario private jet charter,,0,,0.00
london private jet charter ejs,,0,,0.00
long beach jet charter,,0,,2.99
long beach private jet charter,,0,,0.00
long haul private jet charter,,0,,0.00
long range charter jets,,0,,0.00
los angeles ca private jet charter,,0,,0.00
los angeles charter jets,,0,,0.00
los angeles las vegas private jet charter,,0,,0.00
louisiana private jet charter,,0,,0.00
louisville private jet charter,,0,,2.99
love jet charter,,0,,0.00
low cost jet charter,,0,,0.00
low fair charter jets,,0,,0.00
low pressure propane jet chart,,0,,0.00
lowest cost jet charter,,0,,0.00
lowest price jet charter,,0,,0.00
lp gas jet size chart,,0,,0.00
lpaz jet charter,,0,,0.00
lpcs jet charter,,0,,0.00
lpg jet conversion chart,,0,,0.00
lpj private jet charter,,0,,0.00
lpj private jet charter jonathan hull,,0,,0.00
lpps jet charter,,0,,0.00
lrm pipes jet chart,,0,,0.00
ls nitrous jet chart,,0,,0.00
lszh jet charter,,0,,0.00
ltz 400 atv jetting chart,,0,,0.00
ltz400 jetting chart,,0,,0.00
lufthansa a330 jet seating chart,,0,,0.00
lufthansa a333 jet seating chart,,0,,0.00
lufthansa airbus a333 jet seating chart,,0,,0.00
lufthansa airbus industrie a333 jet seating chart,,0,,0.00
lufthansa airbus industrie a343 jet seating chart,,0,,0.00
lufthansa boeing 744 jet seating chart,,0,,0.00
lufthansa boeing 767 jet seating chart,,0,,0.00
lufthansa boeing 777 jet seating chart,,0,,0.00
lufthansa canadair regional jet 900 seating chart,,0,,0.00
lufthansa charter jet,,0,,0.00
lufthansa private jet charter,,0,,0.00
luhr jensen jet diver dive chart,,0,,0.00
lunken jet charter,,0,,0.00
lux air jet centers jet charter,,0,,0.00
lux private jet charter,,0,,0.00
luxury air charter large jets,,0,,0.00
luxury charter jet,,0,,2.47
luxury jet charter prices,,0,,0.00
luxury jet charter uk,,0,,0.00
luxury jet charter vegas business,,0,,0.00
luxury jet charter vegas vacation,,0,,0.00
luxury jumbo jet charter,,0,,0.00
luxury private international jet charter,,0,,0.00
luxury private jet charter las vegas,,0,,0.00
luxury private jet charter los angeles,,0,,0.00
luxury private jets for charter,,0,,0.00
ma jet charter,,0,,0.00
maa jet chart airway,,0,,0.00
maastricht netherlands jet charter,,0,,0.00
madrid jet charter,,0,,2.99
madrid private jet charter,,0,,0.00
magellan jet charter cards,,0,,0.00
magellan jets customizable jet cards & charter,,0,,0.00
magno jet nozzle chart,,0,,0.00
maia jet charter,,0,,0.00
main jet comparison chart,,0,,0.00
main jet drill size chart,,0,,0.00
main jet sizes chart,,0,,0.00
malaga jet charter,,0,,2.99
malaysia private jet charter price,,0,,0.00
maldives private jet charter,,0,,0.00
malta jet charter,,0,,0.00
malta private jet charter,,0,,0.00
manchester jet charter,,0,,0.00
marie carpe world wide jet charter,,0,,0.00
marie carpe worldwide jet charter,,0,,0.00
marketing positioning jet charter,,0,,0.00
marquis mirage le jet size chart,,0,,0.00
martha's vineyard charter jet,,0,,0.00
massachusettes jet charter,,0,,0.00
matrix jet charter,,0,,3.26
matrix jet charter com,,0,,0.00
mattel private jet chart,,0,,0.00
max jet conversion chart,,0,,0.00
mcdonnell douglas md 80 stretch jet seating chart,,0,,0.00
mcdonnell douglas md 83 jet seating chart,,0,,0.00
mcdonnell douglas md 88 jet seating chart,,0,,0.00
mcdonnell douglas md-80 twin-jet seating chart,,0,,0.00
mcdonnell douglas md-83 twin-jet seating chart,,0,,0.00
md 80 jet seating chart,,0,,0.00
md 88 jet seating chart,,0,,0.00
md 90 jet seating chart,,0,,0.00
medical jet charter,,0,,0.00
memphis jet charter,,0,,0.00
mercury carburetor jetting chart,,0,,0.00
meribel france jet charter,,0,,0.00
meridian air charter jet center teterboro,,0,,0.00
met life jets seating chart,,0,,0.00
met office jet stream chart,,0,,0.00
metcheck jet stream chart,,0,,0.00
methanol jetting chart,,0,,0.00
methanol jetting chart holley,,0,,0.00
methanol nitrous jet chart,,0,,0.00
metlife seating chart ny jets,,0,,0.00
metlife stadium jets interactive seating chart,,0,,0.00
metlife stadium seating chart for jets game,,0,,0.00
metlife stadium seating chart jets game,,0,,0.00
metlife stadium seating chart jets seat numbers,,0,,0.00
metro charter academy jets,,0,,0.00
metro charter academy jets videos,,0,,0.00
mexico city charter jet,,0,,3.51
mexico city jet charter,,0,,0.00
mi jet charter,,0,,0.00
miami beach jet charter,,0,,0.00
miami charter jets,,0,,0.00
miami private jet charter cost,,0,,0.00
miami private jet charter price,,0,,0.00
miami private jet charter quote,,0,,0.00
michael carter jets depth chart,,0,,0.00
michael charter jets,,0,,0.00
michigan jet charter,,0,,1.22
mid size charter jets,,0,,0.00
mid size jet charter,,0,,1.92
mid size jets charter,,0,,0.00
middle east jet charter,,0,,0.00
midsize charter jet,,0,,0.00
midsize jet charter greenville,,0,,0.00
mike abee jet charter scottsdale,,0,,0.00
mike williams depth chart jets,,0,,0.00
mikuni 169 needle jet dimension chart,,0,,0.00
mikuni 5 series jet needle chart,,0,,0.00
mikuni 568 needle jet dimension chart,,0,,0.00
mikuni 864 needle jet chart,,0,,0.00
mikuni altitude jetting chart,,0,,0.00
mikuni carb jet chart,,0,,0.00
mikuni carb jets chart,,0,,0.00
mikuni carb main jet chart,,0,,0.00
mikuni carb needle jet chart,,0,,0.00
mikuni carb pilot jet size chart,,0,,0.00
mikuni carburetor main jet chart,,0,,0.00
mikuni dellorto jet size chart,,0,,0.00
mikuni hex jet size chart,,0,,0.00
mikuni jet chart,,0,,0.00
mikuni jet conversion chart,,0,,0.00
mikuni jet diameter chart,,0,,0.00
mikuni jet flow chart,,0,,0.00
mikuni jet needle chart,,0,,0.00
mikuni jets vs keihin jets chart,,0,,0.00
mikuni jetting chart,,0,,0.00
mikuni jetting chart four stroke,,0,,0.00
mikuni keihin jet conversion chart,,0,,0.00
mikuni main jet conversion chart,,0,,0.00
mikuni main jet diameter chart,,0,,0.00
mikuni main jet drill size chart,,0,,0.00
mikuni main jet flow chart,,0,,0.00
mikuni main jet size chart pdf,,0,,0.00
mikuni needle jet 568 chart for tuning,,0,,0.00
mikuni pilot jets chart,,0,,0.00
mikuni small hex jet size chart,,0,,0.00
mikuni snowmobile carb jetting chart,,0,,0.00
mikuni snowmobile jet chart,,0,,0.00
mikuni tm jet size chart,,0,,0.00
mikuni vm 34 needle jet chart,,0,,0.00
mikuni vm jet chart,,0,,0.00
mikuni vm22 jet size chart,,0,,0.00
mikuni vm30 jet chart,,0,,0.00
mikuni vm30-77 jet chart,,0,,0.00
military jet chart,,0,,0.00
military jet identification chart,,0,,0.00
millionair charter jet,,0,,0.00
milwaukee charter jet,,0,,0.00
milwaukee jet charter,,0,,0.00
milwaukee private jet charter,,0,,0.00
mini rok jetting chart,,0,,0.00
minneapolis jet charter quotes,,0,,0.00
minnesota jet charter,,0,,2.99
minnesota private jet charter,,0,,0.00
mississippi jet charter,,0,,0.00
modesto private jet charter,,0,,0.00
mojito air charter selling jets,,0,,0.00
mole jet charter,,0,,0.00
monaco jet charter,,0,,0.00
monterey ca charter jets,,0,,0.00
monterey private jet charter,,0,,0.00
monterrey jet charter,,0,,0.00
montreal private jet charter,,0,,0.00
moped army jetting chart,,0,,0.00
moped jet size chart,,0,,0.00
moped jet tuning chart,,0,,0.00
morristown charter jet,,0,,0.57
morristown jet charter,,0,,0.00
moscow private jet charter,,0,,0.00
most expensive jet charter,,0,,0.00
most luxurious charter jet,,0,,0.00
most luxurious private jet charter,,0,,0.00
most popular charter jet,,0,,0.00
most popular charter jet service,,0,,0.00
most popular charter jets,,0,,0.00
most powerful us fighter jets chart,,0,,0.00
motorcraft 740 jet chart,,0,,0.00
motorcycle carburetor jetting chart,,0,,0.00
motorcycle jet chart,,0,,0.00
motorcycle nitrous jet chart,,0,,0.00
mountain max 700 triple jet chart,,0,,0.00
mountain max 700 triple jetting chart,,0,,0.00
mps nitrous jet chart,,0,,0.00
ms jet charter,,0,,0.00
mts center winnipeg jets seating chart,,0,,0.00
mts centre jets game seating chart,,0,,0.00
mts centre jets seating chart,,0,,0.00
mts centre seating chart winnipeg jets,,0,,0.00
mts centre winnipeg jets seating chart,,0,,0.00
mts jets seating chart,,0,,0.00
mts seating chart for jets games,,0,,0.00
mts seating chart jets,,0,,0.00
mts seating chart winnipeg jets,,0,,0.00
mts winnipeg jets seating chart,,0,,0.00
much charter a jet,,0,,0.00
multi jet fusion vs sls chart,,0,,0.00
munich jet charter,,0,,2.99
music private jet charter,,0,,0.00
must jet charter companies be licensed in florida,,0,,0.00
mustan jet charter,,0,,0.00
mustang 302w 650holley carb jet chart,,0,,0.00
mustang jet charter,,0,,0.00
mlaga jet charter,,0,,0.00
nairobi jet charter,,0,,0.00
nairobi private jet charter,,0,,0.00
nano nitrous jet chart,,0,,0.00
napa charter jet,,0,,2.29
napa jet center charter,,0,,0.00
napa valley private jet charter company,,0,,0.00
naples florida jet charter,,0,,0.00
nashville business jet charter,,0,,0.00
nashville charter jet,,0,,0.00
nashville jet charter flights,,0,,0.00
nashville private jet charter flights,,0,,0.00
nassau jet charter,,0,,0.00
national jet charter,,0,,0.00
national jets charter,,0,,0.00
navy fighter jet chart,,0,,0.00
nba charter jet,,0,,0.00
nba charter jets,,0,,0.00
nd jet charter,,0,,0.00
ne jet charter,,0,,0.00
nebraska jet charter,,0,,0.00
needle jet 568 chart for tuning,,0,,0.00
net jet charter cost,,0,,0.00
net jet charter flights,,0,,0.00
net jets charter hotline,,0,,0.00
netjets charter jet service,,0,,0.00
netjets charter jet services,,0,,0.00
netjets private charter jets,,0,,0.00
netjets private jet charter,,0,,0.00
new charter jet raleigh durham,,0,,0.00
new charter jets,,0,,0.00
new england vs jets depth chart,,0,,0.00
new englang vs jets depth chart,,0,,0.00
new hampshire jet charter,,0,,0.00
new jersey jets depth chart 2017,,0,,0.00
new jet charter,,0,,0.00
new jets stadium seating chart,,0,,0.00
new private jet charter service,,0,,0.00
new tmx jetting chart,,0,,0.00
new york city jet charter,,0,,0.00
new york city private jet charter,,0,,3.94
new york city private jet charter the ea,,0,,0.00
new york jet depth chart,,0,,0.00
new york jet stadium seating chart,,0,,0.00
new york jets 2013 depth chart,,0,,0.00
new york jets 2015 depth chart,,0,,0.00
new york jets 2015 depth chart pro football focus,,0,,0.00
new york jets 2018 depth chart,,0,,0.00
new york jets 2019 depth chart,,0,,0.00
new york jets 2019 offseason depth chart,,0,,0.00
new york jets 2020 depth chart,,0,,0.00
new york jets 2023 qb depth chart,,0,,0.00
new york jets defense depth chart,,0,,0.00
new york jets defensive depth chart,,0,,0.00
new york jets deoth chart,,0,,0.00
new york jets deprh chart,,0,,0.00
new york jets dept chart,,0,,0.00
new york jets depth chart 2009,,0,,0.00
new york jets depth chart 2011,,0,,0.00
new york jets depth chart 2015 espn,,0,,0.00
new york jets depth chart after free agency,,0,,0.00
new york jets depth chart cbs,,0,,0.00
new york jets depth chart espnespn.com team depth name nyj,,0,,0.00
new york jets depth chart pff,,0,,0.00
new york jets depth chart rb,,0,,0.00
new york jets depth chart roto,,0,,0.00
new york jets depth chart rotoworld,,0,,0.00
new york jets depth chart running back,,0,,0.00
new york jets depth chart week 1 2019,,0,,0.00
new york jets depth chart yahoo,,0,,0.00
new york jets depth charts,,0,,0.00
new york jets dpeth chart wr,,0,,0.00
new york jets expected depth chart 2019,,0,,0.00
new york jets fantasy depth chart,,0,,0.00
new york jets linebacker depth chart,,0,,0.00
new york jets metlife seating chart,,0,,0.00
new york jets metlife stadium seating chart,,0,,0.00
new york jets offensive depth chart,,0,,0.00
new york jets offensive line depth chart,,0,,0.00
new york jets official depth chart,,0,,0.00
new york jets ourlads depth chart,,0,,0.00
new york jets preseason depth chart,,0,,0.00
new york jets psl chart,,0,,0.00
new york jets qb depth chart 2017,,0,,0.00
new york jets qb depth chart 2022,,0,,0.00
